Name,Description,Estimation (Hours),Date
Project Initialization,Set up the initial Git repository structure and configure branch protection rules for the team,2,2025-09-01
CI/CD Pipeline Setup,Configure automated build and linting pipelines to ensure code quality before merging,4,2025-09-01
Database Schema Design,Analyze requirements and design the Entity Relationship Diagram for the core database tables,6,2025-09-02
Database Environment Setup,Initialize the PostgreSQL database container with Docker and apply initial configuration,3,2025-09-02
Authentication Module,Create the basic directory structure and module configuration for user authentication,2,2025-09-03
User Registration Logic,Implement the backend service to handle new user sign-ups including data validation,5,2025-09-03
Security Implementation,Integrate password hashing algorithms to securely store user credentials,3,2025-09-04
Token Management,Set up JWT generation and validation strategies to secure API endpoints,4,2025-09-04
Login Functionality,Develop the logic to verify user credentials and issue access tokens upon successful login,5,2025-09-05
User Profile Retrieval,Implement functionality to retrieve and display the current user's profile information,2,2025-09-05
Frontend Setup,Initialize the client-side application using React and configure the build tools,2,2025-09-08
UI Theme Configuration,Set up the design system and configure the global color palette and typography,4,2025-09-08
Login Screen UI,Design and implement the user interface for the login page with error handling,6,2025-09-09
Registration Screen UI,Create the user registration form with client-side validation for all inputs,6,2025-09-09
State Management Setup,Configure the global state store to manage user authentication status,3,2025-09-10
Auth Integration,Connect the frontend login and registration forms to the backend API services,5,2025-09-10
Cross-Origin Config,Configure CORS policies to allow secure communication between frontend and backend,1,2025-09-11
Dashboard Layout,Build the main application shell including the sidebar navigation and header,8,2025-09-12
Product Data Model,Define the database entities and relationships required for product management,2,2025-09-15
Product Management API,Develop the backend endpoints to create read update and delete products,8,2025-09-15
Data Seeding,Create a script to populate the database with dummy data for development purposes,2,2025-09-16
Product Catalog UI,Develop the main grid view to display available products to the user,6,2025-09-17
Filtering Logic,Implement backend logic to filter database results based on category and price range,5,2025-09-18
Filter Sidebar UI,Create the user interface controls for filtering the product list,4,2025-09-18
Auth Unit Testing,Write unit tests to verify the correctness of the authentication service logic,4,2025-09-19
Product Unit Testing,Write unit tests to ensure product management business logic handles edge cases,4,2025-09-19
E2E Test Environment,Set up the end-to-end testing framework to simulate real user scenarios,3,2025-09-22
Login Persistence Fix,Resolve an issue where the user session was not persisting after page reload,2,2025-09-22
Code Refactoring,Refactor the user controller to improve code readability and reduce duplication,1,2025-09-23
Order Data Model,Design the database tables to store order information and order items,3,2025-09-23
Order Creation Logic,Implement the business logic to process a user's cart and generate a new order,8,2025-09-24
Cart Storage Backend,Set up a temporary storage mechanism (Redis) to hold user shopping cart items,5,2025-09-25
Cart Drawer UI,Develop a sliding drawer component to show the contents of the shopping cart,6,2025-09-26
Add to Cart Feature,Implement the frontend logic to add products to the global cart state,3,2025-09-26
Order History Service,Create the backend service to retrieve a list of past orders for a specific user,3,2025-09-29
Order History Page,Design the frontend page to display a table of the user's previous orders,5,2025-09-29
Payment Integration,Integrate the third-party payment gateway to handle secure credit card transactions,13,2025-09-30
Payment Webhooks,Implement a webhook handler to update order status upon successful payment,5,2025-10-01
Calculation Fix,Fix a rounding error in the total price calculation logic for orders,1,2025-10-02
Email Service Config,Configure the email provider integration for sending transactional emails,3,2025-10-02
Welcome Emails,Implement logic to send a welcome email automatically after user registration,2,2025-10-03
Order Receipts,Set up automated email receipts to be sent after a successful purchase,3,2025-10-03
Admin Access Control,Implement role-based access control to restrict administrative routes,2,2025-10-06
Admin Analytics UI,Create a dashboard view for admins showing key sales and user metrics,8,2025-10-07
User Moderation Tools,Develop an interface for admins to view and ban suspicious user accounts,5,2025-10-08
Product Editing UI,Create a form for administrators to modify existing product details,6,2025-10-09
Image Uploads,Implement functionality to upload and store product images in cloud storage,5,2025-10-10
Image Optimization,Set up a serverless function to automatically resize images for better performance,8,2025-10-13
Database Tuning,Analyze query performance and add necessary indexes to foreign key columns,2,2025-10-14
Mobile Layout Fix,Fix layout issues preventing the application from rendering correctly on mobile devices,3,2025-10-14
Performance Optimization,Audit the application bundle size and implement code splitting to improve load time,4,2025-10-15
Route Lazy Loading,Refactor the routing configuration to load page components only when needed,2,2025-10-15
API Documentation,Add comprehensive comments and decorators to generate Swagger API documentation,6,2025-10-16
Rate Limiting,Configure API rate limiting to prevent abuse and denial of service attacks,2,2025-10-17
Logging Infrastructure,Set up a centralized logging system to track errors and application events,5,2025-10-20
Cart Bug Fix,Fix a critical bug where the cart would empty itself unexpectedly,2,2025-10-21
Auth Middleware Refactor,Simplify the authentication middleware to make it more maintainable,1,2025-10-21
Search Backend,Implement full-text search capabilities to allow finding products by name or description,6,2025-10-22
Search Component,Create a search bar with auto-suggestion capabilities for the frontend,3,2025-10-23
Real-time Notifications,Set up a WebSocket gateway to push real-time updates to connected clients,8,2025-10-24
Notification Toasts,Implement a UI component to display ephemeral success and error messages,4,2025-10-27
Staging Deployment,Configure the deployment pipeline to push the latest build to the staging server,3,2025-10-28
Staging Smoke Test,Perform a manual pass through critical user flows on the staging environment,2,2025-10-28
Migration Fix,Resolve a database migration conflict causing deployment failures,1,2025-10-29
Security Audit,Review and rotate all sensitive environment variables and API keys,1,2025-10-29
Code Review,Review pull requests from the team to ensure code standards are met,5,2025-10-30
Sprint Planning,Participate in the team meeting to estimate tasks for the upcoming sprint,1,2025-10-30
Design Sync,Meet with the design team to review high-fidelity mockups for new features,2,2025-10-31
Dependency Update,Update core framework dependencies to their latest stable versions,3,2025-11-03
Deprecation Fixes,Resolve console warnings caused by deprecated methods in updated libraries,2,2025-11-03
Accessibility Review,Audit the application forms to ensure they meet WCAG 2.1 accessibility standards,4,2025-11-04
Aria Labels,Add missing accessibility labels to icon-only buttons throughout the app,1,2025-11-04
Integration Testing,Write tests to verify the data flow from the cart to order creation,5,2025-11-05
Load Testing,Perform stress testing on the API to determine maximum concurrent user capacity,6,2025-11-06
Caching Strategy,Implement Redis caching for high-traffic API endpoints to reduce latency,3,2025-11-07
SEO Optimization,Update meta tags and favicon to improve search engine visibility,1,2025-11-07
Error Pages,Design and implement custom 404 and 500 error pages,2,2025-11-10
Feedback System,Create a form allowing users to submit feedback or report bugs,3,2025-11-11
Feedback Storage,Develop an API endpoint to store user feedback in the database,2,2025-11-11
Dark Mode Logic,Implement a theme provider to toggle between light and dark visual modes,5,2025-11-12
Dark Mode Styling,Fix contrast issues and unreadable text when dark mode is enabled,2,2025-11-13
Localization Setup,Configure the internationalization framework to support multiple languages,4,2025-11-14
Translation Updates,Extract hardcoded text strings and replace them with translation keys,3,2025-11-17
Avatar Upload,Add functionality for users to upload and crop a profile picture,3,2025-11-18
Password Change,Implement a secure form for authenticated users to change their password,4,2025-11-19
Password Recovery,Develop the backend logic to generate and email password reset tokens,5,2025-11-20
Reset Page UI,Create the frontend page where users input their new password,3,2025-11-21
Analytics Validation,Verify that user events are being correctly sent to the analytics platform,2,2025-11-24
Z-Index Fix,Resolve visual layering issues where modals appear behind the header,1,2025-11-24
CSS Modularization,Refactor global CSS styles into modular components to prevent bleeding,3,2025-11-25
Backup Automation,Create a cron job to automatically backup the database to S3 nightly,2,2025-11-26
Uptime Monitoring,Configure external monitoring tools to alert the team in case of downtime,2,2025-11-27
Legal Pages,Create static pages for Terms of Service and Privacy Policy,1,2025-11-27
Cookie Banner,Implement a GDPR-compliant cookie consent banner,2,2025-11-28
Pre-release QA,Conduct a comprehensive round of manual testing before the production release,8,2025-12-01
Checkout Bug Fix,Fix an edge case where the checkout crashes if the cart contains 0 items,3,2025-12-02
Documentation,Update the project README and developer guides with latest instructions,2,2025-12-03
Release Notes,Draft the change log and release notes for version 1.0,2,2025-12-04
Production Launch,Execute the deployment strategy to release version 1.0 to the public,4,2025-12-05